success,answer,response_time_ms,api_type,embedding_model,answer_length,answer_word_count,num_documents,processing_steps,model_info,question,category,difficulty,expected_keywords,keyword_score,structure_score,completeness_score,overall_quality
True,"Berdasarkan PP No. 32 Tahun 1996 (berlaku) Pasal 1 ayat 1, definisi tenaga kesehatan adalah:

""Setiap orang yang mengabdikan diri dalam bidang kesehatan serta memiliki pengetahuan dan/atau keterampilan melalui pendidikan di bidang kesehatan yang untuk jenis tertentu memerlukan kewenangan untuk melakukan upaya kesehatan.""

Definisi ini merupakan acuan resmi yang berlaku saat ini mengenai tenaga kesehatan menurut peraturan pemerintah di Indonesia. 

Perlu dicatat bahwa UU No. 36 Tahun 2009 yang sebelumnya mengatur tenaga kesehatan telah dicabut, sehingga definisi dan ketentuan terkait tenaga kesehatan merujuk pada PP No. 32 Tahun 1996 yang masih berlaku.",7061,simple,small,660,92,4,1,"{'model': 'text-embedding-3-small', 'table': 'documents_small', 'dimensions': 1536}",Apa definisi tenaga kesehatan menurut undang-undang?,definisi,easy,"['tenaga kesehatan', 'setiap orang', 'pendidikan']",1.0,0.4,1.0,0.7999999999999999
True,"Berdasarkan PP No. 32 Tahun 1996 (berlaku) Pasal 1 ayat (1), definisi tenaga kesehatan adalah:

""Setiap orang yang mengabdikan diri dalam bidang kesehatan serta memiliki pengetahuan dan/atau keterampilan melalui pendidikan di bidang kesehatan yang untuk jenis tertentu memerlukan kewenangan untuk melakukan upaya kesehatan.""

Definisi ini juga sejalan dengan yang tercantum dalam UU No. 36 Tahun 2009 (dicabut) Pasal 1 ayat (6), yang menyatakan bahwa tenaga kesehatan adalah setiap orang yang mengabdikan diri dalam bidang kesehatan serta memiliki pengetahuan dan/atau keterampilan melalui pendidikan di bidang kesehatan yang untuk jenis tertentu memerlukan kewenangan untuk melakukan upaya kesehatan.

Namun, karena UU No. 36 Tahun 2009 sudah dicabut, definisi yang berlaku saat ini merujuk pada PP No. 32 Tahun 1996 yang masih berlaku.",6768,simple,large,837,119,4,1,"{'model': 'text-embedding-3-large', 'table': 'documents', 'dimensions': 3072}",Apa definisi tenaga kesehatan menurut undang-undang?,definisi,easy,"['tenaga kesehatan', 'setiap orang', 'pendidikan']",1.0,0.4,1.0,0.7999999999999999
True,Definisi tenaga kesehatan menurut undang-undang adalah setiap orang yang mengabdikan diri dalam bidang kesehatan serta memiliki pengetahuan dan/atau keterampilan melalui pendidikan di bidang kesehatan yang untuk jenis tertentu memerlukan kewenangan untuk melakukan upaya kesehatan (PP No. 32 Tahun 1996 Pasal 1).,21205,multi,small,312,41,5,3,"{'model': 'small', 'parallel_execution': False, 'cached': False, 'modular_architecture': True, 'version': '2.0.0'}",Apa definisi tenaga kesehatan menurut undang-undang?,definisi,easy,"['tenaga kesehatan', 'setiap orang', 'pendidikan']",1.0,0.2,0.812,0.6706666666666666
True,Definisi tenaga kesehatan menurut undang-undang adalah setiap orang yang mengabdikan diri dalam bidang kesehatan serta memiliki pengetahuan dan/atau keterampilan melalui pendidikan di bidang kesehatan yang untuk jenis tertentu memerlukan kewenangan untuk melakukan upaya kesehatan (PP No. 32 Tahun 1996 Pasal 1).,22740,multi,large,312,41,5,3,"{'model': 'large', 'parallel_execution': False, 'cached': False, 'modular_architecture': True, 'version': '2.0.0'}",Apa definisi tenaga kesehatan menurut undang-undang?,definisi,easy,"['tenaga kesehatan', 'setiap orang', 'pendidikan']",1.0,0.2,0.812,0.6706666666666666
True,"Berdasarkan UU No. 17 Tahun 2023 Pasal 260 ayat (2) dan PP No. 28 Tahun 2024 Pasal 678 ayat (2) (kedua peraturan berstatus berlaku), STR (Surat Tanda Registrasi) bagi dokter dan tenaga medis lainnya diterbitkan oleh Konsil atas nama Menteri setelah memenuhi persyaratan yang ditentukan.

Jadi, yang berwenang mengeluarkan STR dokter adalah **Konsil atas nama Menteri Kesehatan**.",4761,simple,small,379,57,4,1,"{'model': 'text-embedding-3-small', 'table': 'documents_small', 'dimensions': 1536}",Siapa yang berwenang mengeluarkan STR dokter?,perizinan,easy,"['konsil kedokteran', 'STR', 'surat tanda registrasi']",0.6666666666666666,0.6,0.7123333333333333,0.6596666666666666
True,"Berdasarkan UU No. 17 Tahun 2023 Pasal 260 ayat (2) dan PP No. 28 Tahun 2024 Pasal 678 ayat (2) (kedua peraturan ini berstatus berlaku), STR (Surat Tanda Registrasi) bagi dokter dan tenaga medis lainnya diterbitkan oleh Konsil atas nama Menteri setelah memenuhi persyaratan yang ditentukan.

Jadi, yang berwenang mengeluarkan STR dokter adalah **Konsil atas nama Menteri Kesehatan**.",6746,simple,large,383,58,4,1,"{'model': 'text-embedding-3-large', 'table': 'documents', 'dimensions': 3072}",Siapa yang berwenang mengeluarkan STR dokter?,perizinan,easy,"['konsil kedokteran', 'STR', 'surat tanda registrasi']",0.6666666666666666,0.6,0.7163333333333333,0.6609999999999999
True,"Berdasarkan dokumen yang tersedia, Surat Tanda Registrasi (STR) dokter diterbitkan oleh Konsil atas nama Menteri setelah Tenaga Medis memenuhi persyaratan tertentu, yaitu memiliki ijazah pendidikan di bidang kesehatan dan/atau sertifikat profesi serta sertifikat kompetensi. Proses pengajuan STR dilakukan secara elektronik melalui Sistem Informasi Kesehatan yang terintegrasi dengan Sistem Informasi Kesehatan Nasional (PP No. 28 Tahun 2024 Pasal 678).

Ketentuan ini juga ditegaskan dalam Undang-Undang No. 17 Tahun 2023 Pasal 260 bahwa STR wajib dimiliki oleh setiap Tenaga Medis yang akan menjalankan praktik dan diterbitkan oleh Konsil atas nama Menteri setelah memenuhi persyaratan tersebut.

Dengan demikian, yang berwenang mengeluarkan STR dokter adalah **Konsil atas nama Menteri**. 

(Sumber: PP No. 28 Tahun 2024 Pasal 678; UU No. 17 Tahun 2023 Pasal 260)",37953,multi,small,866,120,5,3,"{'model': 'small', 'parallel_execution': False, 'cached': False, 'modular_architecture': True, 'version': '2.0.0'}",Siapa yang berwenang mengeluarkan STR dokter?,perizinan,easy,"['konsil kedokteran', 'STR', 'surat tanda registrasi']",0.6666666666666666,0.8,0.8333333333333333,0.7666666666666666
True,"Berdasarkan dokumen yang tersedia, Surat Tanda Registrasi (STR) dokter diterbitkan oleh Konsil atas nama Menteri setelah Tenaga Medis memenuhi persyaratan yang ditentukan. Persyaratan tersebut paling sedikit meliputi memiliki ijazah pendidikan di bidang kesehatan dan/atau sertifikat profesi serta memiliki sertifikat kompetensi. Proses pengajuan permohonan STR dilakukan secara elektronik melalui Sistem Informasi Kesehatan yang terintegrasi dengan Sistem Informasi Kesehatan Nasional.

Dengan demikian, yang berwenang mengeluarkan STR dokter adalah Konsil atas nama Menteri (PP No. 28 Tahun 2024 Pasal 678 dan UU No. 17 Tahun 2023 Pasal 260).",34737,multi,large,644,85,5,3,"{'model': 'large', 'parallel_execution': False, 'cached': False, 'modular_architecture': True, 'version': '2.0.0'}",Siapa yang berwenang mengeluarkan STR dokter?,perizinan,easy,"['konsil kedokteran', 'STR', 'surat tanda registrasi']",0.6666666666666666,0.4,0.8333333333333333,0.6333333333333333
True,"Berdasarkan UU No. 17 Tahun 2023 Pasal 264 (berlaku) dan PP No. 28 Tahun 2024 Pasal 771 (berlaku), dapat dijelaskan bahwa:

- STR adalah singkatan dari **Surat Tanda Registrasi**. STR merupakan dokumen yang wajib dimiliki oleh Tenaga Medis dan Tenaga Kesehatan sebagai bukti registrasi resmi untuk dapat menjalankan praktik di bidang kesehatan.

- SIP adalah singkatan dari **Surat Izin Praktik**. SIP adalah izin yang diberikan kepada Tenaga Medis dan Tenaga Kesehatan untuk melakukan praktik pelayanan kesehatan di tempat praktik tertentu.

Jadi, STR adalah surat tanda registrasi yang menunjukkan legalitas tenaga kesehatan secara profesional, sedangkan SIP adalah surat izin yang mengatur tempat dan izin praktik tenaga kesehatan tersebut. Keduanya wajib dimiliki oleh Tenaga Medis dan Tenaga Kesehatan yang menyelenggarakan pelayanan kesehatan di fasilitas pelayanan kesehatan.",9933,simple,small,882,124,4,1,"{'model': 'text-embedding-3-small', 'table': 'documents_small', 'dimensions': 1536}",Apa kepanjangan dari STR dan SIP?,akronim,easy,"['surat tanda registrasi', 'surat izin praktik']",1.0,0.8,1.0,0.9333333333333332
True,"Berdasarkan PP No. 28 Tahun 2024 (berlaku) Pasal 771 dan Pasal 681, serta UU No. 17 Tahun 2023 (berlaku) Pasal 252, dapat dijelaskan bahwa:

- STR adalah singkatan dari **Surat Tanda Registrasi**. STR merupakan dokumen yang wajib dimiliki oleh Tenaga Medis dan Tenaga Kesehatan sebagai bukti registrasi resmi untuk dapat melakukan praktik pelayanan kesehatan.

- SIP adalah singkatan dari **Surat Izin Praktik**. SIP adalah dokumen izin yang wajib dimiliki oleh Tenaga Medis dan Tenaga Kesehatan tertentu untuk melakukan praktik keprofesiannya di fasilitas pelayanan kesehatan.

Jadi, STR adalah surat tanda registrasi yang menunjukkan bahwa tenaga kesehatan telah terdaftar secara resmi, sedangkan SIP adalah surat izin praktik yang memberikan hak untuk melakukan praktik pelayanan kesehatan secara legal.",10196,simple,large,806,115,4,1,"{'model': 'text-embedding-3-large', 'table': 'documents', 'dimensions': 3072}",Apa kepanjangan dari STR dan SIP?,akronim,easy,"['surat tanda registrasi', 'surat izin praktik']",1.0,0.8,1.0,0.9333333333333332
True,Agent stopped due to max iterations.,32890,multi,small,36,6,14,8,"{'model': 'small', 'parallel_execution': False, 'cached': False, 'modular_architecture': True, 'version': '2.0.0'}",Apa kepanjangan dari STR dan SIP?,akronim,easy,"['surat tanda registrasi', 'surat izin praktik']",0.0,0.0,0.036,0.011999999999999999
True,"Kepanjangan STR adalah **Surat Tanda Registrasi**. STR merupakan dokumen resmi yang wajib dimiliki oleh setiap Tenaga Medis dan Tenaga Kesehatan yang akan menjalankan praktik di Indonesia. STR diterbitkan oleh Konsil atas nama Menteri setelah memenuhi persyaratan seperti ijazah pendidikan di bidang kesehatan, sertifikat profesi, dan sertifikat kompetensi. STR berlaku seumur hidup bagi warga negara Indonesia dan juga wajib dimiliki oleh tenaga kesehatan asing selama menjalankan praktik atau mengikuti program pendidikan spesialis/subspesialis di Indonesia. Pengajuan STR dilakukan secara elektronik melalui Sistem Informasi Kesehatan sesuai ketentuan yang diatur dalam peraturan menteri terkait. Dengan demikian, STR adalah Surat Tanda Registrasi yang menjadi bukti legalitas tenaga kesehatan untuk melakukan praktik di Indonesia (PP No. 28 Tahun 2024 Pasal 677, 678; UU No. 17 Tahun 2023 Pasal 254, 260).

Sedangkan SIP adalah singkatan dari **Surat Izin Praktik**. Surat ini wajib dimiliki oleh setiap Tenaga Medis dan Tenaga Kesehatan tertentu yang akan melakukan praktik keprofesiannya sebagai bukti legalitas dan izin resmi untuk menjalankan praktik tersebut. SIP diberikan bagi Tenaga Medis dan Tenaga Kesehatan tertentu, baik warga negara Indonesia maupun asing, dan berlaku untuk satu tempat praktik selama 5 tahun. SIP dapat diperpanjang dengan memenuhi persyaratan seperti memiliki STR (Surat Tanda Registrasi), tempat praktik, dan pemenuhan satuan kredit profesi. Permohonan SIP dapat diajukan secara online melalui sistem informasi yang terintegrasi dengan Sistem Informasi Kesehatan Nasional, dengan syarat utama memiliki STR dan tempat praktik. Dalam kondisi tertentu, SIP juga dapat diterbitkan oleh Menteri untuk pelaksanaan program internsip, pendidikan dokter spesialis, pemenuhan kebutuhan Tenaga Medis dan Tenaga Kesehatan di kawasan ekonomi khusus, daerah tertinggal, dan percepatan pelayanan kesehatan lainnya. Menteri juga dapat memberikan surat tugas kepada dokter spesialis yang telah memiliki SIP untuk bekerja pada fasilitas pelayanan kesehatan tertentu tanpa perlu memiliki SIP di tempat tersebut. Dengan demikian, SIP berfungsi sebagai izin resmi yang mengatur praktik Tenaga Medis dan Tenaga Kesehatan di Indonesia sesuai dengan peraturan yang berlaku (PP No. 28 Tahun 2024 Pasal 681, 682, 684; UU No. 17 Tahun 2023 Pasal 264, 267).",99343,multi,large,2366,326,10,6,"{'model': 'large', 'parallel_execution': False, 'cached': False, 'modular_architecture': True, 'version': '2.0.0'}",Apa kepanjangan dari STR dan SIP?,akronim,easy,"['surat tanda registrasi', 'surat izin praktik']",1.0,0.6,1.0,0.8666666666666667
True,"Berdasarkan PP No. 32 Tahun 1996 (berlaku) Pasal 35, yang merujuk pada ketentuan Pasal 86 Undang-Undang No. 23 Tahun 1992 tentang Kesehatan, sanksi hukum bagi praktik kedokteran tanpa izin adalah sebagai berikut:

- Barangsiapa dengan sengaja melakukan upaya kesehatan tanpa izin sebagaimana dimaksud dalam Pasal 4 ayat (1) UU No. 23 Tahun 1992 dipidana dengan denda paling banyak Rp 10.000.000,00 (sepuluh juta rupiah).

Perlu dicatat bahwa UU No. 36 Tahun 2009 Pasal 191 yang mengatur sanksi pidana terhadap praktik pelayanan kesehatan tradisional tanpa izin telah dicabut dan tidak berlaku lagi, sehingga ketentuan yang berlaku saat ini adalah berdasarkan PP No. 32 Tahun 1996 tersebut.

Dengan demikian, praktik kedokteran tanpa izin dapat dikenai sanksi administratif berupa denda maksimal Rp 10 juta sesuai ketentuan yang berlaku. Informasi lebih rinci mengenai pidana penjara atau denda yang lebih berat tidak ditemukan dalam dokumen yang tersedia.",9457,simple,small,955,141,4,1,"{'model': 'text-embedding-3-small', 'table': 'documents_small', 'dimensions': 1536}",Apa sanksi hukum bagi praktik kedokteran tanpa izin?,sanksi,medium,"['sanksi', 'pidana', 'denda', 'penjara']",1.0,0.6,1.0,0.8666666666666667
True,"Berdasarkan UU No. 17 Tahun 2023 (berlaku) Pasal 439, setiap orang yang bukan Tenaga Medis atau Tenaga Kesehatan tetapi melakukan praktik sebagai Tenaga Medis atau Tenaga Kesehatan yang telah memiliki Surat Izin Praktik (SIP) dapat dipidana dengan pidana penjara paling lama 5 (lima) tahun atau pidana denda paling banyak Rp500.000.000,00 (lima ratus juta rupiah).

Selain itu, menurut UU No. 17 Tahun 2023 (berlaku) Pasal 313 ayat (1), Tenaga Medis atau Tenaga Kesehatan yang melakukan praktik tanpa memiliki Surat Tanda Registrasi (STR) dan/atau SIP dikenai sanksi administratif berupa denda administratif, dengan tata cara pengenaan sanksi diatur lebih lanjut oleh Peraturan Pemerintah.

Sebagai tambahan, PP No. 32 Tahun 1996 (berlaku) Pasal 35 juga mengatur bahwa melakukan upaya kesehatan tanpa izin dapat dikenai pidana denda paling banyak Rp10.000.000,00 (sepuluh juta rupiah), namun ketentuan ini berada pada level peraturan yang lebih rendah dan nilai sanksi lebih kecil dibandingkan UU No. 17 Tahun 2023.

Dengan demikian, sanksi hukum utama bagi praktik kedokteran tanpa izin adalah pidana penjara hingga 5 tahun dan/atau denda hingga Rp500 juta sesuai UU No. 17 Tahun 2023 Pasal 439, serta sanksi administratif berupa denda bagi Tenaga Medis/Kesehatan yang tidak memiliki STR/SIP sesuai Pasal 313 UU yang sama.",13534,simple,large,1323,196,4,1,"{'model': 'text-embedding-3-large', 'table': 'documents', 'dimensions': 3072}",Apa sanksi hukum bagi praktik kedokteran tanpa izin?,sanksi,medium,"['sanksi', 'pidana', 'denda', 'penjara']",1.0,0.4,1.0,0.7999999999999999
True,"Sanksi hukum bagi praktik kedokteran tanpa izin bagi tenaga medis atau tenaga kesehatan yang melakukan praktik tanpa memiliki Surat Tanda Registrasi (STR) dan/atau Surat Izin Praktik (SIP) adalah sanksi administratif berupa denda administratif. Tata cara pengenaan sanksi administratif ini diatur lebih lanjut dengan Peraturan Pemerintah (UU No. 17 Tahun 2023 Pasal 313).

Selain itu, bagi orang yang bukan tenaga medis atau tenaga kesehatan yang melakukan praktik sebagai tenaga medis atau tenaga kesehatan yang telah memiliki SIP, dapat dipidana dengan pidana penjara paling lama 5 tahun atau pidana denda paling banyak Rp500.000.000,00 (lima ratus juta rupiah) (UU No. 17 Tahun 2023 Pasal 439).

Referensi:
- UU No. 17 Tahun 2023 Pasal 313 tentang Kesehatan
- UU No. 17 Tahun 2023 Pasal 439 tentang Kesehatan",52374,multi,small,811,123,5,3,"{'model': 'small', 'parallel_execution': False, 'cached': False, 'modular_architecture': True, 'version': '2.0.0'}",Apa sanksi hukum bagi praktik kedokteran tanpa izin?,sanksi,medium,"['sanksi', 'pidana', 'denda', 'penjara']",1.0,0.6,1.0,0.8666666666666667
True,"Sanksi hukum bagi praktik kedokteran tanpa izin bagi tenaga medis atau tenaga kesehatan yang melakukan praktik tanpa memiliki Surat Tanda Registrasi (STR) dan/atau Surat Izin Praktik (SIP) adalah sanksi administratif berupa denda administratif. Tata cara pengenaan sanksi administratif ini diatur lebih lanjut dengan Peraturan Pemerintah (UU No. 17 Tahun 2023 Pasal 313).

Selain itu, bagi orang yang bukan tenaga medis atau tenaga kesehatan yang melakukan praktik sebagai tenaga medis atau tenaga kesehatan yang telah memiliki SIP, dapat dikenai pidana penjara paling lama 5 tahun atau denda paling banyak Rp500.000.000 (UU No. 17 Tahun 2023 Pasal 439).

Referensi:
- UU No. 17 Tahun 2023 Pasal 313 tentang Kesehatan
- UU No. 17 Tahun 2023 Pasal 439 tentang Kesehatan",41029,multi,large,768,117,5,3,"{'model': 'large', 'parallel_execution': False, 'cached': False, 'modular_architecture': True, 'version': '2.0.0'}",Apa sanksi hukum bagi praktik kedokteran tanpa izin?,sanksi,medium,"['sanksi', 'pidana', 'denda', 'penjara']",1.0,0.6,1.0,0.8666666666666667
True,"Berdasarkan UU No. 17 Tahun 2023 (berlaku) Pasal 263 dan PP No. 28 Tahun 2024 (berlaku) Pasal 68, prosedur pengajuan izin praktik dokter spesialis adalah sebagai berikut:

1. **Kewajiban Memiliki SIP**  
   Dokter spesialis sebagai Tenaga Medis tertentu wajib memiliki Surat Izin Praktik (SIP) untuk menjalankan praktik keprofesiannya (UU No. 17 Tahun 2023 Pasal 263 ayat (1) dan PP No. 28 Tahun 2024 Pasal 68 ayat (1)).

2. **Pengajuan Permohonan SIP**  
   Permohonan SIP dapat diajukan secara online melalui sistem informasi yang terintegrasi dengan Sistem Informasi Kesehatan Nasional (PP No. 28 Tahun 2024 Pasal 68 ayat (2)).

3. **Persyaratan Pengajuan SIP**  
   Dalam mengajukan permohonan SIP, dokter spesialis harus memiliki:  
   a. Surat Tanda Registrasi (STR) yang masih berlaku;  
   b. Tempat praktik yang jelas (PP No. 28 Tahun 2024 Pasal 68 ayat (3)).

4. **Penerbitan SIP**  
   SIP diterbitkan oleh Pemerintah Daerah kabupaten/kota tempat dokter spesialis menjalankan praktiknya (UU No. 17 Tahun 2023 Pasal 263 ayat (3) dan PP No. 28 Tahun 2024 Pasal 68 ayat (4)).

5. **Batas Waktu Proses Penerbitan**  
   Menteri menetapkan batas waktu maksimal proses penerbitan SIP. Jika proses penerbitan melebihi batas waktu tersebut, SIP secara otomatis terbit melalui sistem informasi yang terintegrasi (PP No. 28 Tahun 2024 Pasal 68 ayat (5) dan (6)).

Dengan demikian, prosedur pengajuan izin praktik dokter spesialis meliputi pemenuhan persyaratan administrasi (STR dan tempat praktik), pengajuan permohonan secara online ke Pemerintah Daerah setempat, dan penerbitan SIP oleh Pemerintah Daerah dengan pengawasan batas waktu oleh Menteri.",13216,simple,small,1652,238,4,1,"{'model': 'text-embedding-3-small', 'table': 'documents_small', 'dimensions': 1536}",Bagaimana prosedur pengajuan izin praktik dokter spesialis?,prosedur,medium,"['persyaratan', 'dokumen', 'pengajuan']",0.6666666666666666,0.8,0.8333333333333333,0.7666666666666666
True,"Berdasarkan UU No. 17 Tahun 2023 Pasal 267 (berlaku) dan PP No. 28 Tahun 2024 Pasal 689 (berlaku), prosedur pengajuan izin praktik dokter spesialis dapat dijelaskan sebagai berikut:

1. **Memiliki Surat Izin Praktik (SIP) Dokter Spesialis**  
   Dokter spesialis yang akan mengajukan izin praktik harus terlebih dahulu memiliki Surat Izin Praktik (SIP) sebagai syarat utama.

2. **Permohonan Surat Tugas oleh Dinas Kesehatan Kabupaten/Kota**  
   Untuk kepentingan pemenuhan kebutuhan pelayanan kedokteran di daerah tertentu, dinas kesehatan kabupaten/kota dapat mengajukan permohonan surat tugas kepada Menteri Kesehatan. Permohonan ini harus disertai:  
   a. Hasil kajian kebutuhan pelayanan kedokteran spesialis di daerah tersebut.  
   b. Pernyataan bahwa tidak ada dokter spesialis dengan keahlian dan kompetensi yang sama di kabupaten/kota tersebut.  
   c. Usulan kandidat dokter spesialis yang akan diberikan surat tugas, lengkap dengan bukti SIP yang dimiliki oleh calon tersebut.

3. **Pemberian Surat Tugas oleh Menteri Kesehatan**  
   Menteri Kesehatan dapat memberikan surat tugas kepada dokter spesialis yang telah memiliki SIP untuk bekerja di Fasilitas Pelayanan Kesehatan tertentu tanpa harus memiliki SIP di tempat tersebut. Pemberian surat tugas ini dilakukan setelah melakukan kajian terhadap permohonan dan kebutuhan yang diajukan oleh dinas kesehatan kabupaten/kota.

4. **Ketentuan Berlaku Surat Tugas**  
   Surat tugas berlaku selama tidak ada dokter spesialis lain dengan keahlian dan kompetensi yang sama di daerah tersebut. Jika kemudian ada dokter spesialis lain yang memenuhi kriteria, surat tugas tersebut menjadi tidak berlaku.

5. **Pendidikan dan Penggunaan Dokter Spesialis**  
   Sesuai UU No. 17 Tahun 2023 Pasal 217 (berlaku), tenaga medis yang telah menyelesaikan program spesialis dapat langsung melaksanakan praktik setelah memiliki SIP, dan selama proses pendidikan spesialis/subspesialis, peserta didik dapat digunakan oleh fasilitas pelayanan kesehatan sebagai bagian dari proses pendidikan.

**Kesimpulan:**  
Prosedur pengajuan izin praktik dokter spesialis melibatkan pemenuhan persyaratan memiliki SIP, pengajuan permohonan surat tugas oleh dinas kesehatan kabupaten/kota berdasarkan kebutuhan dan ketiadaan dokter spesialis sejenis, serta pemberian surat tugas oleh Menteri Kesehatan setelah kajian. Surat tugas ini memungkinkan dokter spesialis untuk praktik di fasilitas pelayanan kesehatan tertentu tanpa SIP tambahan di tempat tersebut.

Referensi utama:  
- UU No. 17 Tahun 2023 Pasal 267 dan Pasal 217 (berlaku)  
- PP No. 28 Tahun 2024 Pasal 689 (berlaku)",17009,simple,large,2613,346,4,1,"{'model': 'text-embedding-3-large', 'table': 'documents', 'dimensions': 3072}",Bagaimana prosedur pengajuan izin praktik dokter spesialis?,prosedur,medium,"['persyaratan', 'dokumen', 'pengajuan']",0.6666666666666666,1.0,0.8333333333333333,0.8333333333333334
True,"Berdasarkan dokumen yang tersedia, prosedur pengajuan izin praktik dokter spesialis diatur melalui pemberian surat tugas oleh Menteri Kesehatan. Surat tugas ini diberikan kepada dokter spesialis yang telah memiliki Surat Izin Praktik (SIP) untuk bekerja di fasilitas pelayanan kesehatan tertentu tanpa perlu mengajukan SIP baru di tempat tersebut. Pemberian surat tugas dilakukan dengan ketentuan sebagai berikut:

1. Ada permintaan dari dinas kesehatan kabupaten/kota berdasarkan kebutuhan pelayanan.
2. Tidak ada dokter spesialis dengan keahlian dan kompetensi yang sama di kabupaten/kota tersebut.
3. Dokter spesialis yang mendapat surat tugas harus sudah memiliki SIP.

Dinas kesehatan kabupaten/kota yang mengajukan permohonan surat tugas harus melampirkan:
- Hasil kajian kebutuhan pelayanan kedokteran spesialis di daerah pengusul.
- Pernyataan ketiadaan dokter spesialis dengan keahlian dan kompetensi yang sama di daerah tersebut.
- Usulan kandidat dokter spesialis yang akan diusulkan beserta bukti SIP maksimal yang dimiliki calon kandidat.

Surat tugas ini memiliki kedudukan hukum yang sama dengan SIP dan memberikan hak serta kewajiban yang sama kepada dokter spesialis yang berpraktik berdasarkan surat tugas tersebut.

Ketentuan lebih lanjut mengenai tata cara pemberian surat tugas diatur dengan Peraturan Menteri.

(Sumber: UU No. 17 Tahun 2023 Pasal 267, PP No. 28 Tahun 2024 Pasal 689 dan Pasal 693 tentang Peraturan Pelaksanaan UU No. 17 Tahun 2023)",69587,multi,small,1470,205,5,3,"{'model': 'small', 'parallel_execution': False, 'cached': False, 'modular_architecture': True, 'version': '2.0.0'}",Bagaimana prosedur pengajuan izin praktik dokter spesialis?,prosedur,medium,"['persyaratan', 'dokumen', 'pengajuan']",0.6666666666666666,0.8,0.8333333333333333,0.7666666666666666
True,Agent stopped due to max iterations.,77630,multi,large,36,6,10,6,"{'model': 'large', 'parallel_execution': False, 'cached': False, 'modular_architecture': True, 'version': '2.0.0'}",Bagaimana prosedur pengajuan izin praktik dokter spesialis?,prosedur,medium,"['persyaratan', 'dokumen', 'pengajuan']",0.0,0.0,0.036,0.011999999999999999
